ham,خواهش می کنم
ham,💋💋💋
ham,مشترک گرامی با مراجعه به سایت www mobilecount cra ir میتوانید از تعداد خطوط تلفن همراه بنام خود مطلع گردید  شرکت مخابرات استان فارس
ham,💋💋😉😉
ham,سلام خانم دکتر من امروز واستان نصب کردم  اگر خواستید پیامکهای تبلیغی بفرستید می توانید از این طریق ارسال کنید  ممنون
ham,سلام آقای مهندس  ممنونم که اطلاع دادید  چشم، حتما  بقیه پیامکها رو اینجا براتون میفرستم
ham,منظورم واتساپ بود 
ham,بله، متوجه شدم
ham,😊
ham,ببخشید فقط بخاطر این بود که نمی خواستم هزینه ای اضافی بر شما تحمیل بشه  باز متشکرم 
ham,خواهش میکنم  ممنونم، لطف دارین
ham,ممنون خانم دکتر 
ham,خواهش میکنم  کاری نکردم
ham,سلام خانم دکتر ممنون میشم اگه به حریم خصوصی کسی آسیب نمیرسونه برای غنای بیشتر محتوایی تعدادی هم پیامک غیر تبلیغاتی ارسال کنید  باز از لطف شما متشکرم
ham,سلام  وقتتون بخیر  باشه، چشم، حتما
ham,سلام استاد    بی زحمت موضوعات رو ممکنه الان بفرستید برام     چون الان اینترنت دستمه
ham,سلام آقای مهندس  من موضوعات رو براتون ایمیل کردم  هر وقت به اینترنت دسترسی داشتین، لطفا ایمیلتون رو چک بفرمایید  متشکرم
ham,سلام استاد متاسفانه ایمیلتون به دستم نرسیده   اگه ممکنه به هر دو تا ایمیلم مجددا ارسال کنید   هم یاهو هم جی میل   ممنونم
ham,خب من امروز بیرون کار دارم در تمام نقاط شهر اگه مسئله ای نیست شما آدرس بدید من بیام خدمتتون  چون امانتی باید زودتر برسه به دستتون 
ham,سلام آقای مهندس  وقتتون بخیر  برنامه من منوط به برنامه پزشک و آزمایشگاه مادرم هست  هر زمانی که شد، خودم مزاحمتون میشم  آدرس بدید میرسم خدمتتون  دیگه بیشتر از این شرمنده تون نشم
ham,سلام  وقتتون بخیر  کامنتها رو براتون فرستادم  تا جاییکه می توانید لطفا آنها را اعمال کنید  لطفا موارد هایلایت شده را تغییر ندهید  متشکرم 
ham,سلام خوبي؟ استاد فرم هاي بچه هايي كه شما مسئول كارآموزيشون هستيد رو دادن به من  هر وقت تشريف آورديد تهران بگيد كه من براتون بيارم
ham,سلام  از شنیدن خبر فوت یکی از فامیلهاتون خیلی ناراحت شدم  خدا به شما و خانواده اش صبر بده و ایشون رو رحمت کنه
ham,سلام ممنون سلامت باشی خدارفتگانتونوبیامرزه والا اتفاق خیلی تلخ وغم انگیزی بود همه روشوکه کرد '(
ham,روز دختر را تبریک می گویم  آرزومندم شرایط جامعه و رفتار مردم به گونه ای باشد که  دختران ما به دلیل دختر بودن از آن چه که شایسته آن هستند، محروم نشوند 
ham,ممنون عالیه
ham,خواهش میکنم
ham, نوبت شما براي دکترمهرداد شمشيري ثبت شد  تاريخ مراجعه 1396/04/21  ساعت حضور پزشک  0800 ساعت حضور شما الزاما یک ساعت قبل از حضور پزشک با کارت شناسایی معتبر، در غیر این صورت نوبت باطل است بيمارستان دكتر خدادوست
ham,دکتر بسیار سپاسگذارم 
ham,خواهش میکنم
ham,سلام خیلی ممنون دست شما درد نکنه، بسیار مفید بود  جسارتا من شماره شما رو ذخیره ندارم ممنون می‌شم خودتون رو هم معرفی نمایید  باز از لطف شما متشکرم 
ham,سلام جناب مهندس، مژده رحمانیان هستم   شرمنده که فراموش کرده بودم براتون بفرستم    این شماره روی تبلتم هست و از زیاد خطش استفاده نمیکنم  ولی پیامک تبلیغاتی زیاد داره!
ham,سلام خانم مهندس، ببخشید بجا نیاوردم  از لطف شما بسیار سپاسگذارم  خیلی عالی بود  ممنون می‌شم اگه به حریم خصوصی کسی آسیب نمیرسونه برای غنای بیشتر محتوایی پیامک‌هایی هم که تبلیغاتی نیستند برای من ارسال نمایید  باز از لطف شما متشکرم 
ham,خواهش میکنم    حتما براتون میفرستم 
ham,موفق باشید 
ham,لطفا هر زمانی که نیاز نیست بفرمایید تا مثل این پیامهای مزاحم من هم مزاحم شما نشم😅
ham,سلام خیلی از لطف شما متشکرم   چون ارسال این پیامک ها برای من برای شما هزینه دارد  فعلا کافیه  دارم یه اپ می نویسم که کار راحتتر بشه  باز از لطف شما متشکر 
ham,سلام آقای مهندس  وقتتون بخیر  ببخشید الان پیامکتون رو دیدم  خواهش میکنم  هزینه اش که زیاد نیست  منم چندتا پیامک بیشتر براتون نفرستادم  کلا قابل شما رو نداره
ham,سلام ارسال کردم 
ham,مرسی
ham,سلام استاد بیدارین؟
ham,سلام ب یاری خدا فیچرها تموم شد
ham,سلام استاد فردا میتونید توی اسکایپ الگوریتم رو توضیح بدین من این هفته کار رو تموم کنم؟
ham,سلام من تا آخر شب فردا به اینترنت دسترسی ندارم
ham,سلام استاد فردا میتونید برا الگوریتم توضیحات بدین
ham,سلام فرمول درصدها رو نفرستادین
ham,سلام دکتر روز بخیر، توانستید با دکتر حمزه هماهنگ کنید؟ نتیجه بخش بود؟
ham,سلام باشه حتما
ham,سلام خوبی آدرس صدرا فاز دو فلکه ارتش بلوار ارتش وقتی رسیدی زنگ بزن میام بیرون تا ببینیم
ham,سلام، آقای رحمانیان داکیومنت رو چند وقت پیش فرستادم تلگرامتون ظاهرا ندیدید  لطفا بررسی کنید اگر مشکلی داره اعلام کنید، چون ممکنه برنامه اعزام به خدمت داشته باشم نتونم چند ماه داکیومنت رو پیگیری کنم/ممنون
ham,مشترک گرامی،درخواست خرید بسته اینترنتی شما ثبت شد،و پس از فعال سازی از طریق پیامک به اطلاع شما خواهد رسید 
ham,سلام مبلغ 177هزار تومان به حساب شما واریز شد  موفق باشید 
ham,سلام علیکم  قابلی نداشت  ممنون از حضرتعالی 
ham,سلام خانم مهندس به گمانم فراموش کردید ایمیلتون رو برای من ارسال کنید  ممنون میشم ایمیل به همراه لیست اطلاعاتی که لازم هست به آدرس زیر ارسال کنید rahmanian@jahrom ac ir ممنون
ham,سلام  وقتتان بخیر  ببخشید من ماموریت بودم  الان ارسال کردم چک میل بفرمایید
ham,جناب مهندس این آدرس ایمیل برگشت میخورد  یک آدرس دیگر را ارسال میفرمایید
ham,سلام ظهر فرستادم  با تلگرام
ham,مشتری گرامی شما در1396/05/04 ساعت1043 وارد اینترنت بانک تجارت شده اید
ham,سلام پدر آقای دولتخواه کسالت قلبی داشتند در صورت صلاحدید و امکان احوالپرسی فرمایید متشکر
ham,ممنون از اطلاع رسانی شما
ham,سلام شوهر خواهرش همکار خوبمان اقای اسماعیل صادقی فوت کرده مراسم مسجد الغدیر امروز عصرهست
ham,ممنون از لطف شما خدا خیرتون بده 
ham,احتمالا اگرجورشد یک رونمایی کوچک هم برات ن میگیریم ان شااله
ham,سلام متنش نوشته ام جلد هم اسکن شده اماده هست گذاشته میشود حتما شما نمونه ای حتی اخدش من نوشتم کتاب به پدر شهیدتان تقدیم کرده اید روحش شاد ان شااله
ham,سلام لطفا دستور فرمایید تبلیغ کتاب اینجانب نیز در سایت دانشگاه قرار گیرد  با تشکر رحمانیان
ham,بِسْمِ اللَّهِ الرَّحْمَنِ الرَّحِیمِ الْحَمْدُ لِلَّهِ الَّذِی جَعَلَنَا مِنَ الْمُتَمَسِّکِینَ بِوِلاَیَةِ أَمِیرِ الْمُؤْمِنِینَ عَلیِّ بنِ أَبِی طالِب وَ الْأَئِمَّةِ علیه و عَلَیْهِمُ السَّلاَمُ  سلام‌  بسم الله الرحمن الرحیم سلام علیکم این عید سعید برشما وخانواده محترم مبارک باد با دعای خیر صلوات التماس دعا ارادتمند
ham,سلام با عرض پوزش که مزاحم شدم  متاسفانه مادرخانم دوست و همکار بسیار خوبمان آقای مهندس بهمن زادگان فوت شدند و امروز جمعه ساعت چهار و نیم تا شش و نیم در مسجدالزهرا شهرک انقلاب مراسم ختم و ترحیم برقرار هست التماس دعا صلوات
ham,سلام زحمت ارسال فرم نحوه امتیاز دهی به همراه توضیحات رو کشیدید؟ ممنون
ham,سلام بله ارسال شد
ham,ممنون
ham,سلام ارسال کردم  اگر نرسیده خبرم کن  ممنون
ham,سلام استاد وقت بخیر من گزارش کارم رو مرداد ماه براتون فرستادم اما متاسفانه هنوز بررسی نکردید برای قدم های بعدی پروژه منتظر پیامتون هستم متشکرم
ham,سلام استاد ميشه لطفا جواب پیام هارو بديد؟
ham,سلام استاد،وقتتون بخیر استاد اگه امکانش هست و فردا دانشگاه تشریف دارید سوال درس کامپایلر هم طراحی کنید ،استاد پارسه فردا ساعت ده رو تعیین کردن برا امتحان درس هوش مصنوعی،شما هم اگه لطف کنید فردا امتحان کامپایلر از من بگیرید ممنون میشم، ،عذرا ذنوبی شاد
ham,مشترک گرامي زمان استفاده شما از هديه تولدتان به پايان رسيده و نرخ تعرفه عادي مکالمه براي شما فعال شده است  همراه اول، همراه لحظه هاي خوش شما
ham,مشترک گرامي هديه تولد شما، بسته 24 ساعت مکالمه رايگان درون شبکه فعال شد و تا تاريخ 1396/06/31 ساعت 085802 معتبر مي باشد  همراه اول، همراه لحظه هاي خوش شما
ham,آقاي محسن رحمانيان تولدتان مبارک! هديه همراه اول براي روز تولد شما 24 ساعت مکالمه رايگان درون شبکه! براي دريافت هديه خود عدد 411 را به شماره 10 پيامک کنيد و يا کد #411*10* را شماره گيري نماييد 
ham,قبض شما با موفقيت پرداخت گرديد هر خريد از #1*   يک شانس شرکت در قرعه کشي ماهيانه پژو 206
ham,مشترک گرامي، هديه شتاب در پرداخت قبض به پايان رسيد و از اين پس مکالمات شما با نرخ عادي محاسبه مي شود 
ham,مشتري گرامي با آرزوي سعادت و سلامتي براي شما در سالروز تولدتان بانک ملت
ham,استاد پروژه بنده که برای ترم تابستان بوده تا کی میتونم دفاع کنم؟
ham,سلام استاد وقت بخیر ،جسارتا من بابت پروژه مزاحم شدم،اگر امکان داد لطفا برای پروژه راهنمایی کنید،ممنون
ham,سلام از مسافرت برگردم بررسی می کنم 
ham,سلام استاد عصر بخیر ،ببخشید من بابت پروژه مزاحم شدم قرار بود پروژه من را برسی کنید ،ممنون میشم اگر راهنمایی کنید
ham,سلام استاد وقت بخیر ،جسارتا امکان دارد یک وقت تماس به من بدید؟ ممنون
ham,سلام جوملا Joomla
ham,سلام آقا محسن خوب هستی؟ میگم اسم این نرم افزار که باش وب سایت طراحی میکردی چی بود؟
ham,من تو آرایشگاه هستم بعدش بت زنگ میزنم
ham,سلام ممنون از پیگیری ها دستت درد نکنه
ham,سلام پرسیدم  بهم گفتند به خیلی چیزها بستگی داره  بسته به آپشن ها از لحاظ زمانی بین یک تا دوماه واز لحاظ مالی بین دو تا پنج میلیون هزینه داره  موفق باشید
ham,سلام تلگرام چک کنید
ham,سلام تلگرام چک‌کنین
ham,سلام انشاءالله یکشنبه دانشگاه میبینم  شما رو 
ham,سلام اومدین جهرم؟
ham,ب موقعیت جغرافیایی دانشگاه توجه بفرمایید
ham,دانشگاه اگ سرویس بود میشه کاریش کرد
ham,سلام انشاءالله آخر هفته آینده  شنبه بعدش من دانشگاهم بیا پیشم 
ham,سلام استاد آن شاالله تا کی جهرم هستین
ham,سلام در مسافرتم هنوز اینترنت ندارم 
ham,سلام استاد مقالات رو نفرستادین
ham,سلام استاد مقاله ها رو بفرستین ک سریعتر ترجمه اش کنم
ham,سلام استاد من تا آخر هفته باید برم تا اصفهان و برگردم ی مشکلی برا رآکتور آب جوششون پیش اومده باید برم ی نگاهی بهش بکنم بیام
ham,سلام آخر شب آنلاین میشین من ی سوالی بپرسم
ham,سلام هستین ؟
ham,😐روش نمک باید استفاده شود
ham,مهمون ها هنوز نرفتن 
ham,استاد کی میاین؟
ham,تحریم های ایران هردفعه داره تمدید میشه  من تازه میخواهم یکم استراحت کنم  On شدم خبرت میکنم 
ham,استاد ی ساعت شد
ham,امشب میاین تلگرام
ham,استاد چک کنید فرستادم
ham,سلام شانس ماس
ham,کلا شبکه اینترنت ما قطع شده  (ایرانسل و td-lte )  😠 درست گفتی کدت هم خیلی دردسر داره برا اجرا 😅
ham,سلام استاد کی میاین برا اتمام پروژه ،
ham,سلام استاد پارامترهای svm باید چی بذارم
ham,سلام استاد بهترین الحمدلله؟
ham,سلام عکس یادت نرود  صادقی
ham,مشترک گرامی در تاریخ 1396/6/25 سیم‌ کارت ثبت‌ شده شما به شماره  09177924643  در اپراتور همراه اول تعویض گردیده است  در صورت وجود مغایرت به اپراتور مذکور مراجعه فرمایید 
ham,مشترک گرامي، با عنايت به حضور شما در دفتر خدماتي فارس در تاريخ 1396/06/25 ساعت 193857 درخواست عدم اطلاع از رمز دوم براي شما ثبت گرديد 
ham,سلام به  اهل بیت اگرامکانش هست براتون امشب بریم خونه سوسن هرچه زودترپیام بدین باتشکر 
ham,سلام ما الان خونه سوسنیم 
ham,Mohsen Rahmanian [25 09 17 1743] سلام استاد میتونم تماس بگیرم خدمتتون؟ در رابطه با درس پروژه
ham,فرمای کارآموزیمونو کی باید تحویلتون بدیم استاد
ham,سلام استاد  رهايي هستم ميتونم چند لحظه وقتتونو بگيرم؟
ham,بي زحمت يه لطفي كنيد هروقت پياممو ديديد يه جواب بدين تا من باهاتون تماس بگيرم   ممنون
ham,سلام مهندس رحمانیان، رامین قاسمی ام واستون ۲روز پیش ایمیل زدم،لطفا ایمیلتون رو چک کنین باتشکر
ham,سلام مهندس جان روز بخیر  بی زحمت ادرس جی میل یا ایمیل رو برام بفرستین تا چند مقاله و کد رو براتون بفرستم مخلصیم رستگار
ham,اوکی
ham,با کارشناس هماهنگ کنید  کارنامه رو دیدم برای اون موضوع مشکلی نیست فقط یکم باید بیشتر تلاش کنید 
ham,استاد تو لیست انتخاب واحد برای من نیومده   
ham,ارائه شده 
ham,استاد میگم مگه پیشرفته ای ترم ارائه نمیشه   
ham,شماره دانشجویی شما چنده؟
ham,سلام استاد گفته بودین صبح بهتون خبر بدم تا اول یه نگاهی به کارنامم بندازین
ham,سلام خوبي؟ مصلي نژاد هستم، چه ساعتي تماس بگيرم؟ ممنون
ham,سلام وقت بخیر من یکی از دانشجویان شما هستم که  برای ترم بهمن میخواستم  باهاتون پروژه بردارم،موضوع پروژه رو برام انتخاب کردین ولی هنوز درس پروژه رو نگرفتم میخواستم اگه میشه برای ترم مهر همون پروژه باهاتون بردارم روی پروژه ام یه مقداری کار کردم ولی هنوز کامل نشده چند باری بهتون ایمیل زدم ولی انگار بدستتون نرسیده بود اگه امکان داره جواب پیاممو بدین   ممنونم
ham,مشترک عزیز لطفا توجه داشته باشید که برای دریافت هدایا، جوایز قرعه کشی و    به هیچ وجه نیازی به مراجعه به عابربانک و وارد نمودن اطلاعات کارت بانکی ندارید  مراقب سواستفاده کلاهبرداران وسودجویان باشید 
ham,سلام عزیزم لطفا تخم مرغ و5-6تا گوجه اگه تونستی بخر ممنونم
ham,سلام من الان دانشگاه هستم هر موقع تشریف آوردید خبر بدید برسم خدمتتون 
ham,ما که چاره ای جز اینکه بگیم خیره نداریم  😔
ham,سلام خیره بله میام دانشگاه ساعت 9 دانشگاهم 
ham,خیره عامو صبرم بده بقول شیرازیا فرداهستی ببینمت؟
ham,سلام دکتر انگار خبری نشد  تصمیمی گرفتید؟ امتیازها به حدنصاب مورد نظر رسید؟ لطفا خبرم کنید چون خیلی نگرانم و فکرم رو مشغول کرده  از کار و زندگی افتادم به خدا  ممنون که به پیغام هام توجه می کنید 
ham,سلام ممنون میشم هروقت امتیازها مشخص شد من رو در جریان بذارید  باز متشکرم
ham,ظاهرا کل داوری ها۵امتیازداره
ham,سلام از بند سه تعدادی هم داوری اختراع داشتم که انشاءالله لحاظ شود  ممنون
ham,سلام امروزیافردا بادکترحمزه جلسه دارم
ham,سلام دکتر صبح آمدم دفتر معاونت تشریف نداشتید  خواستم پیگیری وضعیت خودم کنم  چون دیگه خیلی وقتی نمانده برای امسال  ممنون
ham,سلام ممنون خدا خیرتون بده 
ham,سلام من امشب رسیدم شیراز فردامیرم پیداش میکنم
ham,سلام دکتر خبری از دکتر حمزه نشد؟
ham,سلام نه هنوز فعلا من بادکترحمزه داریم قایم موشک بازی می‌کنیم من آمدم تهران،براش کارپیش آمدرفته شیراز،فرستادم براش شیراز،برگشت تهران عجله نکن بگذار برگردم ایشالا حلش میکنیم نگران نباش
ham,سلام دکتر خواستم پیگیری کنم ببینم دکتر حمزه جواب دادند  اگر مشکلی پیش آمده بهم بگید من دیگه به خبرای بد عادت کردم  ممنون
ham,سلام دکتر خواستم پیگیری کنم ببینم دکتر حمزه جواب دادند  ممنون
ham,من خودم بیشتر ازشما می‌خوام که بشه و بیشترضررنکنی نگران نباش حاج محسن
ham,یه دنیا ممنون  خدا خیرتون بده 
ham,سلام منم ظهربرای دکترحمزه فرستادم بهش گفتم تاآخرهفته جوابم بده
ham,سلام آقا قناعتیان گفتند که اطلاعات درخواستی رو برای شما ارسال کردند  ممنون میشم یه بررسی بفرمایید  متشکر
ham,اختیارداری وظیفه اس خداکنه که بشه و شما هم راحت بشی
ham,سلام ممنون از پیگیری شما  انشاءالله بتونم جبران کنم 
ham,سلام دکترجدول توزیع امتیازات را میخواست من ندارم قرارشدقناعتیان برام شنبه بفرسته تا برای دکتر بفرستم
ham,سلام دکتر روز بخیر، توانستید با دکتر حمزه هماهنگ کنید؟ نتیجه بخش بود؟
ham,به امید خدا
ham,سلام انشالله چارشنبه که اسکندری هم بیاد
ham,بیمه شده گرامی شرکت سهامی بیمه ایران، طبق پرونده خسارت درمان شماره 1396/179/8191/11249 چک به مبلغ 2572160 ریال به نام محسن رحمانیان در تاریخ 1396/05/29 صادر گردید #HB03
ham,بیمه شده گرامی شرکت سهامی بیمه ایران، طبق پرونده خسارت درمان شماره 1396/179/8191/10832 چک به مبلغ 140000 ریال به نام محسن رحمانیان در تاریخ 1396/05/10 صادر گردید #HB03
ham,داوطلب گرامی، نتایج نهایی پذیرفته شدگان آزمون دکتری سال 1396 در سایت این سازمان در دسترس قرار گرفته؛ لازم است برای اطلاع از تاریخ، نحوه و مدارک لازم برای ثبت نام به اطلاعیه مندرج در سایت مذکور مراجعه نمایید  سازمان سنجش آموزش کشور
ham,پیام صوتی جدید ازشماره9178408678دریافت شد لطفا با شماره 09912  جهت شنیدن پیام تماس بگیرید
ham,یخ و فرش بی زخمت فراموش نشه
ham,سلام  اره  ساعت حدود 8 شهربازی
ham,سلام برنامه امشب به راهه؟ ساعت چند و کجا؟
ham,سلام ارسال گردید لطفا تایید بفرمایید
ham,سلام خانم دکتر آمدم دفتر تشریف نداشتید  انشاءالله فرصتی دیگر
ham,سلام  من مرخصی هستم  از یکم یه سری میزنم چه خبر از هوشمند سازی؟
ham,دخملا اتومات ویار دارن جوجو ک باشه یکم شدیدمند میشه
ham,داداش شرمنده اینجا مهمون اومده شما جای ما هم خوش بگذرونید
ham,اره اشکالی نداره    اگه میخوای منو مامانم وتو میتونیم بیرم
ham,رفت حاجی به طواف کعبه و باز آمد ما به قربان تو رفتیم و همانجا ماندیم عیدت مباااارک جانم!
ham,خیلی داغون بودم حسابی چسبید ایشالله واست جبران کنم عزیزم
ham,اوکی خوبه حرم رفتی منم دعا کن اصلا اس بده خودم بزنگم گوشیتو بگیر رو به ضریح اوکی؟پلیز؟؟
ham,فقط محض اینکه شاید امروز کسی بهت نگفته باشه من بهت میگم که خیلی خوبی
ham,لا اله الا الله داعشق عشق بی رحمتر از داعش و تکفیری است   
ham,کسی که لبخندی همیشگی در چهره اش وجود دارد میخواهد یک مشکل تقریبا وحشتناک را پنهان کند 
ham,شیرجه های نرفته گاهی کوفتگی های عجیبی برجای میگذارند 
