ham,خواهش می کنم
ham,سریع بیا دنبالم کارت دارم زوددددددددددد باش
ham,خخخخخخخخخخخخخخخخخخخ شوخی کردم بابا
ham,خیلی گلی حرف نداری مردوووووووو
ham,ناموسا سلام
ham,یارو میره قصابی گوشت بخره               چیه مگه گوشت خریدن خنده داره؟؟؟؟؟؟
ham,رفتم نشون دادم گفت اصل اصله منم اصل خریدم جنس تقلب نمیخرم مطمئن باش
ham,ای بابابابابابباباباباباباباباباباابابابا
ham,منم و جواد و ایرانسل ههههههههههههههههههه
ham,پیام بدون متن بفرس به 1814 درست میشه
ham,دیگه نمیدونستم چیکار کنم وقت هم برای خوندن کنکور نداشتم که این پیامک برام اومد الان دارم رشته پزشکی  دانشگاه تهران میخونم اگر میخوای راز موفقیتم بهت بگم یک پیامک بدون متن به همین شماره ارسال کن 
ham,مرد مومن منو اینجا کاشتی میخوای یچی بهت بگم؟؟؟؟؟
ham,خوووووووووووووووووووووووووووبه
ham,مرسیییییییییییییییییییییییییییییییییییییییییی
ham,به کیه؟Ki
ham,یه آهنگ شاد برام بفرس
ham,Error 691 مال چیه این ؟
ham,سلام اومدم خونتون نبودی
ham,من رفتم نمایندگی همراه اول گفت همچین سیم کارتی نداریم
ham,عجببببببببببببببببببببببببب
ham,منم بابا میلادم
ham,خوش اومدی دیواااااااااااااااااااااااااااااااااااااااااانه
ham,پاشو بیااااااااااااااااااااااااااااااااااااااااااا
ham,من قهرم!
ham,سیم کارت رند همراه اول میخوای!!! برو نمایندگی معتبر همراه اول و توی جزیره طلایی ثبت نام کن!!!
ham,با سلام!درخواست شما با موفیقت ثبت شد سازمان صنعت،معدن و تجارت استان فارس
ham,مهندس درخواستت  توی سازمان ثبت کردم 
ham,عجب ادمی هستیااااااااااااااااااااا
ham,خو میگم نه
ham,هوووووووووووووووووووووی
ham,الووووووووووووووووووو
ham,من  خودروی مزدا برنده شدم
ham,به به چه هوایی شده نه؟؟؟؟؟
ham,خداکریمه
ham,اه
ham,خب
ham,زود باش بیا دیگه
ham,انتقال وجه به کارت8998*************** مبلغ2200000000 کد پیگیری45545454454
ham,آهنگ دیروزی مال کی بود؟؟؟؟
ham,کد آهنگو بفرست برام
ham,2112121 اینم از این
ham,وای خدا چکار کنم حالا
ham,برنامه نویسی داریم
ham,سر کلاسم بعدا زنگ میزنم
ham,چاکرم
ham,فدایت
ham,خداکنه
ham,باشه بهت برنامه نویسی یاد میدم
ham,قرآنو دوس داری حفظ کنی؟؟؟؟
ham,من حوصله درس خوندن ندارم
ham,بابام دیروز بهت زنگ زد چی گفت؟
ham,باشه اشکال نداره بشین قرآن بخون
ham,من همشو حفظ کردم
ham,رفتم خریدم
ham,نه نمیخواااااااااااااااااااااااااااااااااااااااااااااااااد
ham,تورو خداااااااااااااااااااااااااااااااااا
ham,با سلام مهر شما در قلب من فعال شد 
ham,مشترک گرامی!سرویس آوای انتظار شما فعال شد 
ham,سللللللللاممممم
ham,بع بع میکنی
ham,یا چی؟؟؟؟؟؟؟؟؟؟؟؟؟؟
ham,من سوپرمارکتم بیا اونجا
ham,چطوری؟
ham,حال و احوالت خوبه
ham,عید سعید فطر بر شما و خانواده محترمتان تبریک عرض می نمایم 
ham,باشه من همون بد شما خوب باش خخخخخخخخخخخخخخ
ham,چشششششششششششششمممممممممممممممممممممممم
ham,ممنونتم
ham,تو حروف ابجد بلدی بفرستی به همین شماره
ham,اره فرستادم
ham,الف ب ج د ه و ز ح ط ی ک ل م ن س ع ف ص ق ر ش ت ث خ ذ ض ظ غ
ham,چنتاست؟
ham,بشمار
ham,میای بریم کوه آخر هفته
ham,نه نمیتونم بیام
ham,ذکر یا من اسمه دوا و ذکره شفا بگو
ham,باید اسباب کشی بکنه
ham,ببخشید اشتباه فرستادم
ham,من  و تو و اون بنده خدا
ham,من به محسن خیلی امید دارم ادم باهوشیه
ham,پیامت ناقص اومد
ham,آره فهمیدم
ham,گفتم که اگر تونستم چشم
ham,من نمیتونم که هرساعت برات بفرستم
ham,پیامک به صورت زیر ارسال شود 1-نام و نام خانوادگی 2-کدپستی 3-شماره همراه
ham,حاج محسن مهدوی مسئول تدارکات +989123655555
ham,Great بفرس به همین پست
ham,کارت سوختم فراموش کردم
ham,رمز وای فای برام بفرست
ham,Lionاین مارکشه حتما آبی رنگ باشه
ham,امید داره میاد درو براش باز کنین
ham,آهنگ پیشواز شما با کد 6615457  با موفقیت جایگزین شد 
ham,سرپرست گرامی!یارانه تیرماه به حساب شما واریز شد 
ham,با تشکر از استاد گرامی جناب آقای مهندس رحمانیان،امیدوارم که مورد رضایت واقع گردد 
ham,من حاضرم آمونیاک خالص تنفس کنم ولی…  بوی ماه مهر به مشامم نرسه      
ham,تولدت آغاز زیباییها ست هزاران گل یاس سپید تقدیمت میکنم
ham,سلامتی اون کسی که ساقی نبود ولی هر روز برامون عرق ریخت    !! پدر
ham,هر شب پنجرہ‌های ملکوت آسمان، بسوی قلبها گشودہ میشود    الهی امشب! ﮐﯿﻨﻪ ﺭﺍ ﺍﺯ قلبہای ‌ما ﺑﺰﺩﺍﯼ و نور ایمانت را درقلبهایمان جاری کن شبتون بخیر
ham,فرجه چیست؟ همانطور که قبل از ذبح به گوسفند آب می‌دهند ، به دانشجو هم قبل از امتحانات فرصتی می‌دهند تا برای خودش خوش باشد
ham,مهربان کـه باشی خورشید از سمت قلب تو طلوع خواهد ڪرد و صبح مگر چیست ؟ جز لبخند مهربانت    سلام صبح بخیر لبخند خدا بدرقه نگاه مهربانتان
ham,سلام انشاالله نیم ساعت دیگه
ham,اگه بتونید پنج دقیقه مونده به هفت فلکه مرکزی باشید خوبه
ham,سلام   میای بریم بیرون ؟
ham,خودم پیگری می کنم شما نگید   فقط اگه پرسید اشاره کن  
ham,امروم یکم طول میکشه اما در کل بین 2 تا سه ساعت
ham,سلام ارسال شد  لطفا حتما در گروه اعلام کنید 
ham,سلام شرمنده این چند روز مسافرت بودم امروز رسیدم فردا در خدمتم
ham,سلام این با ارفاق خیلی زیاد هست به بقیه هم بگو دیگه تغییر نمیکنه
ham,سلام  استاد بچه ها می پرسن فردا هم می تونن تمرین بیارن تحویل بدن یا نه؟
ham,قبل از شما سه نفر دیگم ج دادن ولی شرکت گفته فقط به دو نفر بده  ایشالا معمای بعدی
ham,وقتشو داری ی ویندوز واس من عوض کنی؟؟
ham,۱۰ جلسه کلاس آنلاینه   هر واحد هم ۷۵ تومن
ham,مال ما خیلی سخت بود همه ۵ دقیقه اول بلند شدن
ham,می تونین استفاده کنین
ham,فک کنم مشکل از سرورهای تلگرامه
ham,ادم تو محدوديت ها ستاره ميشه
ham,پول پیش خونه اگه در میاد باشه مشکل نداره
ham,خواب بودم الان موبايلم چك كردم
ham,الان نمیتونم صحبت کنم بعد زنگ میزنم!
ham,سلام کد ملیتو بفرس رو همین شماره که وقتش محدوده
ham,دیگر شده ام دچار وسواس بیا/بدجور به عصر جمعه حساس بیا/آقاجان گفته بودی به عموی خود ارادت داری/اینبارقسم به دست عباس بیا    اللهم عجل لولیک الفرج
ham,هشت سال دفاع مقدس مظهر ایثار و از خود گذشتگی است  مقام معظم رهبری
ham,دانشپذیر گرامی لطفا جهت صدور گواهینامه نهایتا تا فردا عکس خود را در سایت آموزش آپلود نمایید 
ham,سلام، زمان حذف و اضاف  دانشگاه كي هست ؟
ham,سلام خوابگاه شماره ۱۱ با پذیرش ۵۰ نفر ظر فیت تکمیل و هیچ تخت خالی وجود ندارد
ham,🔴قابل توجه دانشجویان دانشگاه جهرم به اطلاع میرساند با توجه به همزمانی ثبت نام دانشجویان جدید الورود با تاریخ تعیین شده برای حذف و اضافه، با تصمیم شورای دانشگاه جهرم، تاریخ حذف و اضافه به روزهای دوشنبه 10 مهرماه و سه شنبه 11 مهرماه منتقل شد  لازم به ذکر است که حذف و اضافه صرفا در روزهای مذکور از طریق سامانه sess قابل انجام خواهد بود و به درخواست های بعد از از تاریخ فوق ترتیب اثر داده نخواهد شد 
ham,اطلاعیه خیابان ملاصدرا از روز سه شنبه مورخ 9 شهریور تا پنج شنبه 11 شهریور یک طرفه میباشد 
ham,جاده هراز از امروز بعدازظهر یک طرفه خواهد شد
ham,ایا میدانستید مصرف روزانه 8 لیوان اب برای بدن انسان ضروری است؟
ham,آیا میدانستید که اگر همه یخهای قطب جنوب آب شود بر سطح آب اقیانوسها هفتاد متر اضافه می شود و در این صورت یک چهارم خشکی های کره زمین زیر آب می رود ؟
ham,آیا میدانستید که خرگوش و طوطی تنها حیواناتی هستند که میتوانند بدون برگشتن اشیاء پشت سر خود را ببینند ؟
ham,آیا میدانستید که انسان‌های راست دست به طور میانگین 9 سال بیش از چپ دست‌ها عمر می‌کنند ؟
ham,آیا میدانستید که مزه سیب، پیاز و سیب زمینی یکی ست و بخاطر بوی آنهاست كه طعم متفاوتی دارند ؟
ham,آیا میدانستید که 1300 کره زمین در سیاره مشتری جای می گیرد ؟
ham,آیا میدانستید که بلند قدترین مرد جهان جان پل آونوو، دو متر و چهل و نه سانتیمتر قد دارد ؟
ham,سلام خوبی؟ تو جهرم کلاس اموزش رادیولوژی و سونو گرافی ندارن؟یا جهاد دانشگاهی بزاره؟
ham,ممنون،بگو چقد شده؟نه میخوام برم کلاسش مدرک بگیرم
ham,تو قشم فک کنم باشه گفتم تو جهرمی شاید بدونی جهرم هست یا نیست
ham,هههههه،باشه فقط اگه برات زحمتی نیست به سوالی یا پرس و جویی بکن ببین جهرم هست یا نه
ham,مگه داراب داره؟
ham,سلام   میثمم   برا کولر کی بریم
ham,سلام!  عادتم داده صفای توکه یادت باشم یاد آن معرفت ومهرومرامت باشم ازبرای همه لطفی که بدیم ازتو کمترین کار همین است که یادت باشم
ham,سلام عکساشو برت فرستادم لی تلگرام
ham,سلام من دارم میام جهرم بری کلاس زبان توهم میای؟
ham,سلام بیو تو واتس آپ بی زحمت چن تاسوال دارم
ham,این جمعه هم از دیدن رویت خبری نیست دیگرنفسم هم نفس معتبری نیست ردمی شود این جمعه وتالحظه آخر ازآمدن سبزتو اما اثری نیست اللهم عجل لولیک الفرج
ham,سلام میلا جوراب خشک بشه میام
ham,سلام میلاد ظهرساعت11میای بریم سلف پایتون باهم کارکنیم؟
ham,اینو توی مرورگر بزنید 5 190 64 2 ببینید باز میکنه؟
ham,یوزر و پسورد برای ورود به پنل چی میزنید؟
ham,یوزرtest2 پسورد22 200 مگ حجم گذاشتم تست کنید
ham,اوکی صبر کنید چک میکنم
ham,الان با گوشیم تست کردم  شما www های اولشو نزنید باز میشه احتمالا
ham,یوزر و پسورد کد ملی گذاشتم
ham,سلام چه مشکلی داره
ham,سلام لطفا قیمت نهایی فروش خدروتون رو بفرمایید مشتری هستم
ham,سلام برادر ماشین چه رنگ هست مگه ضربه ورنگ شدگی داره؟
ham,سلام چه معدنی و در چه مرحله و چه شهری
ham,صبح هم چند بار تلفنت گرفتم انتن میداد ولی زنگ نمیخورد خلاصه خیلی خیلی ازت ممنون هستم خونه هست اگه نمیتونی خودت بیای بدم اسمال برات بیاره چون خودت لازم داری
ham,سلام میلاد یوسف هستم زنگی بزن کارت دارم
ham,عمری که گذرکردازاین سال به آن سال تادیرنشده حال ودگرحال تودریاب لبخندبزن،مهربورز بادلی شاد تااین گذران،بگذردبه بهترین منوال باآرزوی سالی سرشارازشادی وسلامتی برای شماوخانواده محترم🌹 حامدرحیمی تبار
ham,مشترک گرامی! در زمان خرید گوشی تلفن همراه از فروشگاه هایی خرید کنید که دارای پروانه کسب معتبر بوده  و حتما فاکتور خرید ممهور دریافت نمایید  معاونت پیشگیری از وقوع جرم قوه قضاییه 
ham,مشترک گرامی! در هنگام خرید گوشی تلفن همراه دقت نموده، زیرا در صورت خرید گوشی مسروقه، در نهایت فردی که گوشی را بدون فاکتور خریداری نموده، تحت تعقیب قضایی قرار خواهد گرفت  معاونت پیشگیری از وقوع جرم قوه قضاییه 
ham,مشترک گرامی! همواره پیش از انجام تراکنش های اینترنتی از صحت آدرس وب سایت اعلام شده در پیامک ها و یا تبلیغات اینترنتی اطمینان حاصل نمایید، زیرا ممکن است این آدرس ها ظاهری موجه داشته باشند، ولی شما را به سایتی جعلی هدایت نمایند  معاونت پیشگیری از وقوع جرم قوه قضاییه  Pegah [26 09 17 1053] ولی راجب سهاما چیزی ننوشته  پرسیدم گفتن اینترنتی قابل پیگیری نیس
ham,سلام خدمت پدر گرامی هم اکنون حاضر و آماده در انتظار شما نشسته ایم لطفا هرچه سریع تر به سمت خانه روانه شوید با تشکر دختر عزیزتان
ham,سلام شبتون بخیر شما اطلاع دارید فردا کلاس برگزار میشه یا نه؟
ham,سلام خوبی ؟ میگم یه لحظه میتونی بیای تلگرام این سواله رو برام حل کنی ؟
ham,هنرمند هنوز نیومده  ربع ساعت دیگه میرسه بلیط بگیرم ممکنه نرسه به ما
ham,اره قراره دایی بیاد اینجا باباجون داره میاد دنبال ما ببرتمون بگو زودتر بیاد
spam, لیزر دایود GME تکنولوژی آلمان کامل ترین ، مناسب ترین و موثرترین لیزر جهت موهای زائد بدن و صورت دکتر بهمنی جهرم   54234524-071
spam, هديه ما به شما 30گيگ اينترنت رايگان همراه اول در ماي اپس براي دانلود بهترين فيلمها و لينك دانلود آنها به صورت روزانه قرعه كشي ماهيانه  سفرخارجي، گوشي آيفون7، گوشي گلگسي8 با ارسال 2
spam, حميد ماهي‌صفت بمب خنده ايران براتون كلي لطیفه داره! جوک‌های جديدی كه تاحالا نشنيدي رو با شماره‌گيري 99221010 گوش كن و كلي بخند  هر دقیقه 500 تومان
spam, سرمايه گذاري مطمئن با خريد اوراق گواهي عام با نرخ 17 درصد از تاريخ 7 تا 12 مردادماه در شعب بانك كشاورزي استان فارس
spam, مشترک گرامی برای عضویت در بازی استراتژیک آنلاین شهروار (مشابه کلش آو کلنز)، هر چه سریعتر عدد 1 را ارسال کنید  * فقط همین امروز هدیه 120 هزار تومانی اعتبار درون برنامه ای را از دست ندهید * هرچه سریعتر عدد 1 را به  به همین شماره ارسال کنید
spam, سومین کنفرانس بین المللی انقلاب چهارم صنعتی با حمایت همراه اول و حضور سخنرانانی از اروپا  22 و 23 تیرماه مرکز همایش های برج میلاد www industry40 ir همراه اول، رتبه اول اپراتورهای تلفن همراه کشور
spam, امشب، شبکه دوم سیما، قبل از خبر 2030 (ساعت 20) همراه اول، رتبه اول اپراتورهای تلفن همراه کشور در چهار سال دولت یازدهم، شما را به دیدن ویژه برنامه افتتاح پروژه های فاز سوم شبکه ملی اطلاعات در همراه اول با حضور وزیر محترم ارتباطات، دعوت می کند 
spam, تابستان امسال با رومینگ همراه اول در کشور های مهم جهان جهت اطلاع از تعرفه های رومینگ نام کشور یا کد آن را (بدون دو صفر) به سامانه 8070 ارسال کنید  در تمامی کشور ها روشن نمودن گوشی هزینه ندارد و دریافت پیامک رایگان است  جهت کسب اطلاعات بیشتر به پرتال همراه اول به نشانی www mci ir مراجعه کنید  همواره اول با رومینگ همراه اول
spam, شهادت امام جعفر صادق (ع) را تسلیت می گوییم  با ارسال عدد 110 به 8888 و پرداخت روزانه 110 تومان، در ساخت صحن و شبستانی به نام حضرت فاطمه(س) در جوار حرم مطهر حضرت علی(ع) سهیم شوید  مشارکت بیشتر و پرداخت مبلغ دلخواه با شماره گیری کد *1*888# همراه اول با مشارکت ستاد بازسازی عتبات عالیات
spam, با 1000 شروع می شه    با 1000 باش!
spam, هر هفته یک موتور 1000 به ارزش 1000 میلیون ریال با استفاده از بسته های آلفا+ اینترنت همراه نوترینو خرید بسته با شماره گیری *100*2#
spam, یه پیشنهاد به صرفه با شماره گیری *1000*1# از پیشنهاد بسته مکالمه خود مطلع شده و با مکالمه دقیقه ای 16 تومان، بیش از 70% تخفیف بگیرید 
spam, مشترک گرامی با توجه به عدم چاپ قبض تلفن همراه جهت جلوگیری از قطع ارتباط و استفاده از یک روز مکالمه رایگان نسبت به پرداخت بدهی خود تا قبل از 20/05/1396 از طریق سامانه 9990 یا دستگاههای ATM یا مراجعه به دفاتر خدمات ارتباطی اقدام فرمایید
spam, خدمات قابل ارایه در مرکز تماس 9990  اصلاح مشخصات(قطع مغایرت مشخصات)--مشاهده و اعلام نوع قطعی تلفن همراه---چک نمودن وصولی مشترک---حذف پیامک های ارزش افزوده
spam, هایپراستار 8و5/9 پاکبان دوغ قوطی6ع40%ت فلاسک ست قاشق چنگال21ع 99000ت
spam, هایپراستار3و5/4 LED55SAMSUNG 2829000ت+هدیه گوساله مخلوط1ک 32900ت
spam, هایپراستار1و5/2 مارس انواع شکلات50% ملحفه نیم ست کشدوز45%ت طالبی ک750ت
spam, هایپراستار27و4/28 برنج ایرانی5ک25%ت روغن آفتاب810گ30%ت قزل آلا11490ت
spam, هایپراستار 25و4/26 حوله وتن پوش در4سایز50%ت سن ایچ انواع آبمیوه1ل40%ت
spam, مشترک گرامی با اپلیکیشن تخفیف اول از بیشترین تخفیف‌های کالا و خدمات فروشگاه‌های اینترنتی باخبر شوید  جهت عضویت عدد 111 را به همین شماره پیامک کنید 
spam, لذت محض یادگیری انگلیسی! توسط سرویس نبشت فقط با 10 دقیقه زمان در روز زبان انگلیسی خود را تقویت کنید و در قرعه کشی  جایزه 100000000 ریالی شرکت کنید  با ارسال 1 به 305058
spam, دوست عزیز برای عضویت در سرویس ویدئویی تاملی (ویدئو HD آشپزی) عدد 1 را به همین شماره ارسال کنید  در این اپلیکیشن روش پخت انواع غذاهای ایرانی و بین المللی بصورت ویدئو با کیفیت قرار داده شده است  *از طرفی شما شانس برنده شدن ماهانه 10 شارژ 10000 ریالی به قید قرعه دارید *  با ارسال 1 به همین شماره
spam, * اپلیکیشن آوا یک قدم جلوتر از بقیه * جدیدترین آلبوم های موسیقی  با ارسال 1 موسیقی و فراتر ازآن * با قرعه کشی خودرو 206 *
spam, تحویل فوری باتسهیلات قرض الحسنه در جشنواره تابستانه محصولات گروه سایپا
spam, جایزه بزرگ الماس شهر(خودروی پراید) هرخرید 1 امتیاز بیش از100قلم تخفیف
spam, خریدخودروهای فرسوده بالاترین قیمت نقدی09170017475-54222435مرکزجهرم2617
spam, لیزر دایود GME تکنولوژی آلمان کامل ترین ، مناسب ترین و موثرترین لیزر جهت موهای زائد بدن و صورت دکتر بهمنی جهرم   54234524-071
spam, یکدست پیراهن مبل راحتی فقط 180هزار فروش نمایشگاه جنب تالار المهدی جهرم
spam, یکدست شیرآلات اهرمی سنگین 250هزار فروش نمایشگاه جنب تالارالمهدی جهرم
spam, بافیش حج به سرزمین وحی سفرکنیدتمتع خرید10فروش11عمره800ت 09172012091-99
spam, سیمکارت صفرورندخودرا از www Rondtarin ir تهیه فرماییدودرب منزل تحویل بگیرید 917-112-88-89 912-222-13-14 تلگرام t me/rondtarin
spam, عطر روحبخش  ربنای  جبروت و رحمت فطرگوارای وجود پاکتان و نگاه ایزد منان همواره همراهتان عید سعیدفطر برشما و خانواده محترمتان مبارکباد اداره روابط عمومی واطلاع رسانی کمیته امدادامام خمینی(ره)استان فارس
spam, با پرداخت زکات فطریه به نیازمندان، عید بندگی را جشن می گیریم  پرداخت فطریه و کفاره از طریق www emdad ir ویا شماره گیری کد *8877*1# کمیته امداد امام خمینی(ره)
spam, ایام شهادت امیرالمومنین تسلیت باد  گزیده آواهای انتظار ویژه شهادت حضرت علی و شبهای قدر 30815 لیله قدر (هلالی) 46869 شب غریبان قدر (هلالی) 64506 مولایم علی (اقتباسی) 64742 مناجات امیر المومنین (سماواتی) 33857 حب علی (گروه تواشیح) 33865 مولا امیرالمومنین (گروه تواشیح) شنیدن آواها در کانال تلگرام https//t me/www_mci_ir فعالسازی با ارسال کد آوا به 8989 هزینه فعالسازی 300 تومان
spam, كنگره بين المللي مطالعات ميان رشته اي درعلوم پايه-مهندسي انتشارمقالات درISI SID Academia www irse2017 com كانال تلگرام @irSE2017com
spam, حمیدرضا تقی زاده مدیر دفتر پیشخوان دولت با کد 167
spam, همایش نیروهای انقلابی سخنران حاج آقای پناهیان امروز 5 عصرمصلی نمازجمعه
