ham,خواهش می کنم
spam, میلاد حضرت علی (ع) و روز پدر گرامی باد جهاددانشگاهی جهرم مهندس فصیحیان
spam, بازیهای اندروید باکیفیت رو دوست دارید؟ بازی هیجان انگیز ماشین سواری جدل بر روی سرعت رو یک میلیون نفر در کشور بازی کرده اند حالا نسخه دوم این بازی با گرافیک اچ دی حجم بسیار پایین  چهار ماشین چهار جاده و امتیازات آنلاین در دسترس شماست این بازی رو برای روزهای عید به شما پیشنهاد میکنیم برای دانلود بازی جدال بر روی سرعت عدد 1 رو به 307878 ارسال کنید  قیمت تنها یکبار 3000 تومان بدون محدودیت زمانی
spam, در روزهای تلخ و شیرین با کانال اخبار جهرم میهمان خانهٔ شما بودیم  امید که امسال،سال تحولات مثبت در راستای پیشرفت و توسعه‌ی شهر عزیزمان باشد نوروزتان شاد  مهندس امین رحمانیان مدیر کانال اخبار جهرم
spam, نوروز؛ آئین کهن ایرانیان بر شما ایران زمینی ها مبارک  بانک ایران زمین
spam, بسته خوش آمد نوترينو آلفا+ شما به پايان رسيد  از اين پس کارکرد اينترنت شما با تعرفه عادي محاسبه خواهد شد  لطفا براي مديريت هزينه اينترنت همراه خود با شماره گيري کد دستوري #100* اقدام به خريد بسته نماييد 
spam, تورتایلند مستقیم ازشیراز 25آبان ماه پرواز قطر گنجینه پرواز 07132348991
spam, مژده به همشهریان عزیز فروش ویژه نقد-اقساط خودروهای ام وی ام برای اولین بار در جهرم آغاز گردید 07154375221
spam, مشتري گرامي با آرزوي سعادت و سلامتي براي شما در سالروز تولدتان بانک ملت
spam, بهترین ذکر در گرفتاریها لاحول ولاقوه الابالله العلی العظیم… دریافت سخنان آیت الله بهجت باارسال210 4روز اول رایگان سپس روزانه35تومان
spam, عید سعید فطرمبارک باد  اعطاء وام قرض الحسنه با 2% کارمزد سالیانه بانک قرض الحسنه رسالت شعبه جهرم تلفن  54229541-54229539
spam, با سلام بیمه شده گرامی با کلیک بر روی آدرس زیر به کانال رسمی تلگرام سازمان تامین اجتماعی بپیوندید و از جدیدترین اخبار و قوانین سازمان تامین اجتماعی با خبر شوید آدرس کانال https//telegram me/taminnews
spam, بافیش حج به سرزمین وحی سفرکنیدتمتع خریدوفروش11عمره800ت 09172012091-99
spam, مشترک گرامی به راحتی زبان انگلیسی را بیاموزید  کافیست عضو مؤسسه مجازی آموزش زبان انگلیسی لینگونت شوید  کافیست عدد ۱ را به همین شماره ارسال نمایید 
spam, سلام خط 09178978752به قیمت29000تومان بفروش میرسد پرداخت وجه زمان تحویل
spam, مشترک گرامی برای عضویت در بازی استراتژیک آنلاین شهروار (مشابه کلش آو کلنز)، هر چه سریعتر عدد 1 را ارسال کنید   * فقط همین امروز هدیه 120 هزار تومانی اعتبار درون برنامه ای را از دست ندهید * هرچه سریعتر عدد 1 را به  به همین شماره ارسال کنید
spam, آفری تفلیس950 تفلیس+باتومی1/690 آنکارا پرواز ترکیش 990 همنواز 02184278
spam, سرمايه گذاري مطمئن با خريد اوراق گواهي عام با نرخ 17 درصد از تاريخ 7 تا 12 مردادماه در شعب بانك كشاورزي استان فارس
spam, حميد ماهي‌صفت بمب خنده ايران براتون كلي لطیفه داره! جوک‌های جديدی كه تاحالا نشنيدي رو با شماره‌گيري 99221010 گوش كن و كلي بخند  هر دقیقه 500 تومان
spam, هديه ما به شما 30گيگ اينترنت رايگان همراه اول در ماي اپس براي دانلود بهترين فيلمها و لينك دانلود آنها به صورت روزانه قرعه كشي ماهيانه  سفرخارجي، گوشي آيفون7، گوشي گلگسي8 با ارسال 2
spam, آنتالیا1290 تفلیس790 تفلیس+باتومی1690 مشهد335 کیش300 قشم480 02184278
spam, مشترک گرامی به راحتی زبان انگلیسی را بیاموزید  کافیست عضو مؤسسه مجازی آموزش زبان انگلیسی لینگونت شوید  کافیست عدد ۱ را به همین شماره ارسال نمایید 
spam, دکتر دهدشتی [30 07 17 1347] واریز1000تومن شارژرایگان درون برنامه درجشنواره گردشگری فقط باارسال 6 تا پایان امروز اپ گردشگر قرعه کشی ویلادبلکس اشتراک روزی سیصدتومن
spam, دکتر دهدشتی [30 07 17 1922] این داستانِ چهار فصل نیست، این داستان،‌ هفت فصل دارد  تازه ترین اثر حسین علیزاده،‌ * غمنومه ی فریدون * در هفت فصل منتشر شد  در ریتم،‌ آن را دریافت کنید  لینک دریافت  http//bit ly/2uNIvdd
spam, دکتر دهدشتی [30 07 17 1923] هدیه رایگان اپ دوربین را خودتان انتخاب کنید 1  شارژ هزار تومانی 2  اینترنت رایگان فقط امروز با ارسال گزینه اشتراک روزی سیصد تومن
spam, دکتر دهدشتی [30 07 17 2007] برات کلی آهنگ و جایزه داریم، با ارسال رایگان 1 این فرصت رو از دست نده
spam, دکتر دهدشتی [31 07 17 1357] شمابرنده 1000تومن شارژ رایگان می شوید فقط امروز تاییدودریافت باارسال1ونصب اپ همگردی+قرعه کشی ویلای 250میلیون تومنی عضویت روزی300تومن
spam, اینترنت 3G را گران نخرید پیشنهاد ویژه امروز بسته ی 600 مگابایتی (یک هفته ای) + 2 4 گیگابایت شبانه فقط با قیمت 70000 ریال است  در صورت تمایل به خرید، عدد 2 را پیامک کنید  در غیر این صورت منتظر پیشنهادهای روزهای آینده بمانید * اگه نمی خوای همراهمون باشی پیام L  رو بفرست هزینه پیام 100تومان پشتیبانی ۰۲۱۴۱۹۵۷  * برگزار کننده بییپ
spam, مجله همراه شارژ رایگان ارسال1به30576 *  * روستای پیته نو روستایی از توابع بخش یانه ‌سر شهرستان بهشهر در استان مازندران ایران می باشد چشمه معروفی به نام افرابن با آبی خنک و گوارا در داخل روستا جاری است که مورد استفاده عموم قرار می‌گیرد * ادامه با ارسال 11 * لغوارسالL پشتیبانی رویال 02186081659 هزینه صدوبیست تومن
spam, بازی سین جیم یه راهنمایی دیگه این شهر پایگاه آغامحمدخان کمی پیش از تاجگذاری قاجار بوده است  - - - - اگر شب ها همه قدر بودی، شب قدر بی قدر بودی  سعدی کلمه ای که حدس زدی رو بفرست 120 تومان لغو با ارسال 0 به 737866 پشتیبانی یارا02142570290
spam, امروزو با پیشوازهای پرطرفدار عالی تر از همیشه شروع کنین پس همین حالا کدهای زیر رو به 7575 ارسال کنید  حامد همایون/چتر خیس/146 مهدی یراحی/ منو رها کن/147 مهدی احمدوند/ بگو من کجام /148  قیمت 300تومن با شماره گیری*777# به دوستانتان پیشواز هدیه دهید
spam, مجموعه ای از فیلم های کلاسیک هم اکنون در «لنز» چیتی چیتی بنگ بنگ، دوازده مرد خشمگین، و     با اینترنت رایگان اپلیکیشن http//i3l ir/getlenz
spam, جدیدترین آموزش فوتبالی+مهارتهای مسی و رونالدو+عکس عضویت باارسال1 سرویس مدرسه فوتبال قیمت120تومان
spam, پژو 206 با 5 میلیون تومان تخفیف به همراه 50٪ تخفیف روی کالاهای هیجان انگیز شروع شد https//www digikala com/mtn
spam, این پیام رایگان است به بازی بازی سین جیم خوش آمدید 10 رو به 737866 بفرست تا بازی شروع شه یه کلمه در نظر گرفتم! راهنماییت میکنم باید حدس بزنیش! تعداد راهنمایی کمتر=امتیاز بیشتر اطلاعات بیشتر در www irancell ir 120 تومان لغو با ارسال 0 به 737866 پشتیبانی یارا02142570290
spam, رمضان امسال می‌تونی برنده تویوتا شاسی بلندCHr بشی کافیه رو لینک زیر بزنی و عضو یکی ازسرویس‌های کمپین بشی http//charkhoneh com/s/2453
spam, آموزش زبان انگلیسی نصرت بدون نیاز به استاد و کلاس-روزی نیم ساعت دانلود از لینک زیر http//charkhoneh com/s/2485
spam, از بقیه جا موندی که! خب ۱ رو بفرست تا تو هم آخرین خبرای نقل و انتقالات لیگ های برتر دنیا رو داشته باشی سرویس خبر ورزشی  پیامی۳۵تومن
spam, روز عید فطر شرکت در قرعه کشی خودرو 206 رو از دست ندهید! ثبت قطعی شماره با ارسال 1 عضویت سرویس ستاره شو 75 تومن
spam, فقط امروز فیلم2017 و 1000شارژهزاری  دریافت تا24ساعت اشتراک=1 سیمای‌همراه هروزسیصدتومن رهپو
spam, یکی از6میلیون برنده  رمضان باشید ارسال1 به2039 روزانه 1گوشی هواویP10 1کارت هدیه1میلیون ت خریدبامیلو روزی300تومن https//goo gl/Xz0XoB
spam, ✋️مــــظلوم کربــــــــلا حســــــــین(ع)✋️ با ارسال 1 به همین شماره، کارت ویزیت خاص محرمی داشته باشید و با گرامیداشت این ماه،با مخاطبان خود تماس بگیرید فعالسازی بسته ماهانه 600ت
spam, یکی از6میلیون برنده جشن رمضان باشید باارسال1 به2041 TapSongاپ موزیک روزانه 1گوشی هواویP10 1کارت هدیه1میلیون ت خریدبامیلو روزی300تومان
spam, هرروز1گوشی هوآوویp10 عضویت بازیک با ارسال1 روزی300تومان3روز اول رایگان
spam, امروزهرتراکنش از *733# وآپ =10شانس درقرعه کشی گوشی گلکسیS8وآیفون7
spam, تعویض رایگان مودم وایمکس باTD-LTE ثبت درخواست در shop irancell ir/swap *با تحویل رایگان*
spam, یه فکر بکر! 5 نفر از دوستانت رو به ساعت خوش دعوت کن تا شارژ 10000 ریالی بگیری  عضویت با ارسال عدد1 روزی 300 تومن
spam, *1000شارژ بین همه * جهت اشتراک و دریافت شارژ10000ریالی عدد 1 را بصورت رایگان ارسال فرمایید اپلیکیشن روزی سیصدتومنی بازی پرو
spam, شارژ 1000 تومانی می خوای؟ 5000 تا شارژ رایگان داریم! همین الان 1رو بفرست! با عضویت در سرویس اکسیر، ،پیامی120 تومن
spam, *اطلاعیه فوری* برای شرکت در قرعه کشی گوشی سامسونگ A5 با ارسال رایگان 1 در سرویس رخصت عضو شوید 100 تومن
spam, آیفون7نداری؟عدد1روبفرست شاید تو برنده شدی عضوسرویس تندرستی شو120تومان
spam, جایزه ویژه 120 میلیون تومان نقد برای شرکت در مسابقه بزرگ ورزشی، همین حالا 1 را به 7778 ارسال کنید  شما با شرکت در مسابقه می توانید برنده 120 میلیون تومان شوید  این پیشنهاد محدود است
spam, دنیای ِ ما اندازه ی ِ هم نیست،من خیلی وقته است ساکتم سردم وقتی که میرم تو خودم شاید پاییز ِ سال ِبعد برگردم پیش فروش آلبوم جدید پاییز سال بعد از رستاک،هم اکنون در برنامه ریتم دانلود از http//i3l ir/ritm7
spam, بافعالسازی پیام پیشوازایرانسل ازبچه های المپیکی حمایت کن وپنج میلیون تومن وجه نقد برنده شو! فعالسازی ماهانه ارسال1به این شماره 450ت
spam, *فقط امروز* طرح بسته ترکيبي رايگان (20مگ اينترنت+500تومان شارژ) براي شماباثبت نام درسامانه فدراسیون کشتی و ارسال1 فعال مي شود 100تومان
spam, سلام خوبی؟دلت گرفته؟ اینایی که میگم وامتحان کن اول عدد1رو بفرست بعد چشماتوببند بعدش نیت کن، جواب فالت روازحافظ میگیری نودونه تومان
spam, حاوی کلی ویتامین ث؟ 1-توت فرنگی 2-به عضویت درسرویس سلامتی صدوبیست تومن
spam, امروزروزشماره شماست 9366094898 تبریک به صاحب خط 100 MB اینترنت رایگان باارسال1به84888 24ساعت بعددریافت کنید عضویت سرویس دین120تومن
spam, دنیای انیمیشن و کارتن برنامه آموزشی متنوع با زوم ایرانسل، فیلم خوب ببین، کیا اسپورتیج ببر) دانلود رایگان از http//ow ly/Pgo4z
spam, محسن چاوشی از امیر بی گزند می گوید  شیدایی 912 چنگیز 913 پریشان 342 امیر بی گزند 343 متصل  344 ارسال کد پیشوازبه7676 قیمت300تومان شماره گیری(کدآهنگ)77به آهنگ مورد علاقه ات گوش کن و نصب کن
spam,  دلتنگم و دیدار تو درمان من است  ترانه عشق/301 به طاها به ياسين/314 ارسال کد به 7676 300تومان شماره گیری(کدآهنگ)77به آهنگ مورد علاقه ات گوش کن و نصب کن
spam, بازی پرطرفدار Larva Crush دانلود رایگان از بازیک http//goo gl/gj8mdL
spam, مشترک عزیز شما واجدشرایط دریافت دوبسته اینترنتی 20مگابایتی وِیژه عیدتا عیداز سرویس پازل شدید با ارسال1به 84831 آن رافعال کنید 150تومان
spam, فاضل کلاس مکالمه زبان صددرصدتضمینی ترمیک2سال فشرده4یا9ماهه 07132338259
spam, تحویل فوری باتسهیلات قرض الحسنه در جشنواره تابستانه محصولات گروه سایپا
spam, فروشگاه بزرگ اكسير شروع حراج بزرگ تابستان مبلمان،تزئينات تهران 0218733
spam, * اپلیکیشن آوا یک قدم جلوتر از بقیه * جدیدترین آلبوم های موسیقی  با ارسال 1 موسیقی و فراتر ازآن * با قرعه کشی خودرو 206 *
spam, لذت محض یادگیری انگلیسی! توسط سرویس نبشت فقط با 10 دقیقه زمان در روز زبان انگلیسی خود را تقویت کنید و در قرعه کشی  جایزه 100000000 ریالی شرکت کنید  با ارسال 1 به 305058
spam, دوست عزیز برای عضویت در سرویس ویدئویی تاملی (ویدئو HD آشپزی) عدد 1 را به همین شماره ارسال کنید  در این اپلیکیشن روش پخت انواع غذاهای ایرانی و بین المللی بصورت ویدئو با کیفیت قرار داده شده است  ****از طرفی شما شانس برنده شدن ماهانه 10 شارژ 10000 ریالی به قید قرعه دارید ****  با ارسال 1 به همین شماره
spam, چهارمین ماراتون برنامه نویسی تلفن همراه کشور 23 الی 25 شهریور ماه دانشگاه صنعتی شریف جهت کسب اطلاع بیشتر http//mpm sharif ir/ https//telegram me/sharifIT
spam, مشترک گرامی با اپلیکیشن تخفیف اول از بیشترین تخفیف‌های کالا و خدمات فروشگاه‌های اینترنتی باخبر شوید  جهت عضویت عدد 111 را به همین شماره پیامک کنید 
spam, هایپراستار 8و5/9 پاکبان دوغ قوطی6ع40%ت فلاسک ست قاشق چنگال21ع 99000ت
spam, با خرید سیم کارت جدید یا استفاده مجدد از سیم کارتی که بیش از 3 ماه غیرفعال بوده است، در قرعه کشی 1000 گوشی هوشمند نسل 4 5 شرکت کنید 
spam, یه پیشنهاد به صرفه با شماره گیری *1000*1# از پیشنهاد بسته مکالمه خود مطلع شده و با مکالمه دقیقه ای 16 تومان، بیش از 70% تخفیف بگیرید 
spam, هر هفته یک موتور 1000 به ارزش 1000 میلیون ریال با استفاده از بسته های آلفا+ اینترنت همراه نوترینو خرید بسته با شماره گیری *100*2#
spam, سرویس کتاپ بدون قرعه کشی بن تخفیف بامیلو بگیرید ارسال1 به 2039  300ت
spam, تبريک! 20 امتياز ايرانسلي به دليل استفاده از اپليکشن ايرانسل من به شما تعلق گرفت  فقط تا پايان اين ماه فرصت داريد تا امتيازات خود را ازطريق کد #1*310* و يا از قسمت امتياز من در ايرانسل من به جايزه تبديل کنيد
spam, تبريک! شما 14گيگ اينترنت همراه 14 روزه به دليل تغييرسيمکارت خود به LTE دريافت کرديد  اطلاع از باقيمانده حساب  #33*141*
spam, تبريک! 20 امتياز ايرانسلي به دليل استفاده از اپليکشن ايرانسل من به شما تعلق گرفت  فقط تا پايان اين ماه فرصت داريد تا امتيازات خود را ازطريق کد #1*310* و يا از قسمت امتياز من در ايرانسل من به جايزه تبديل کنيد
spam, فاضل کلاس صددرصدتضمینی EPT MSRT چهارشنبه17الی21 آغاز4مرداد 07132338259
spam, فاضل گروه4آمادگی آزمون MSRT EPT پنج شبه 14تا18 آغاز12مرداد 07132338259
spam, تنظیمات اینترنت همراه گوشی شماارسال شد لطفا آنرا ذخیره نموده ودرصورت نیازبه رمز، 1234را وارد کنید  تبدیل سیمکارت به4Gبا کد #34*555*  Internet configurations for your phone were sent  Please save them & if a password was needed enter 1234  Dial*555*34# to swap your SIM to 4G 
spam, بسته ویژه 2گیگابایتی، 5000تومان خرید *5# مهلت استفاده تاپایان6مرداد
spam, مشترک گرامي،بسته يکماهه 3 گيگابايت  با هزينه 130000 ريال فعال شد  براي استفاده از بسته اينترنتي خود، اينترنت دستگاه خود را يکبار خاموش و مجددا روشن کنيد  اطلاع از حساب اينترنت همراه با شماره گيري کد زير و يا ازطريق برنامه کاربردي ايرانسل من دانلود از  http//irancell ir/myirancell *555*1*4*1#
spam, مشترک گرامي شارژ الکترونيکي انجام شد ريال  < مبلغ ريال 179 تا  1396/05/04حساب اصلي ريال 45872>اعتبار شما براي شارژ عادي عبارتست از  *7# خريدآسان شارژ با شماره گيري
spam, 10 برابر اعتبار مکالمه ایرانسلی با بسته های 1 روزه، 7 روزه و 30 روزه! همین حالا می توانید پیشنهاد خاص خودتان را از *4444*1#
spam, ایرانسلی عزیز شما می توانید با نصب رایگان برنامه ایرانسل من و دعوت از دوستانتان به این برنامه 1 روز اینترنت نامحدود هدیه بگیرید! دانلود رایگان ایرانسل من http//irancell ir/dlmyicl
spam, 6000 تومان اعتبارمکالمه 30روزه تنها باخریدبسته600تومانی *4444*1*4#
spam, 1گیگابایت اینترنت رایگان برای شماودوستانتان! شماره دوستان ایرانسلی خودرابه3116بفرستیدودعوت کنید سیمکارتشان را4Gکنند 
spam, 892810 کلمه عبور ورود به سیستم تنظیمات اینترنت همراه ایرانسل
spam, پیشنهاد های امروز ما برای آهنگ پیشوازی شما ارسال کد به 7575 فرزاد فرزین /عاشقانه/  68 فرزاد فرزین /عاشقانه 2/  69 فریدون آسرایی/ستگدل / 70 قیمت 300 تومان
spam, با ارسال کدهای زیر به 7575 پیشوازهای هفتگی داشته باشید (میلاد بیکدلو/ بـاران)24 (مرتضی پاشایـی/ قلبم رو تکراره) 26 (علیرضا طلیسچی/نمیخوامت)88 قیمت 126تومان یک هفته
spam, برای 9367912866فقط امروز 1000تومان شارژ رایگان  در پلان با ارسال 3 عضویت روزانه 300 تومان
spam, قبض964 آبونمان6300 مکالمه52998 پيام کوتاه3738 صندوق صوتي1245 صورتحساب64281 ماليات5785 بدهي76622 کسر هزار ريال688 قابل پرداخت146000 ريال ش ق7792464309054 ش پ14662400 دريافت جزئيات کارمزد خدمات با ارسال C و دريافت جزئيات خدمات مبتني بر محتوا و دولت الکترونيک با ارسال K
spam, با شماره گیری #۴۴۴۴*  طرحی خاص به شما پیشنهاد می کنیم که با استفاده از آن می توانید در هزینه های مکالمه و اینترنت خود صرفه جویی کنید 
spam, یک گیگ اینترنت یک روزه جایزه بگیر! کافیه به اپلیکیشن ایرانسل من بری و دوستتو به «لنز» دعوت کنی
spam, پیشنهادویژه 10برابراعتبارمکالمه#4444*1*
spam, بانک قرض الحسنه مهر ايران حساب 4827-700-3759336-1 مبلغ2273000+ انتقال از اينترنت مانده2413000 تاريخ1396/5/4 ساعت1034
spam, دسترسی به کلی فیلم و سریال به همراه یک هدیه خوشمزه با خرید اشتراک ماهانه «لنز» 60% مبلغ اشتراک را برای سفارش غذا از اپلیکیشن «اسنپ‌فود» هدیه بگیرید لینک دانلود رایگان اپلکیشن  http//i3l ir/lenznap
spam, تمام قصه در یک شب میگذرد شبی پر از خیال و اتفاقات عجیب! مادر قلب اتمی با هنرنمایی محمدرضا گلزار، ترانه علیدوستی و پگاه آهنگرانی هم اکنون در «لنز» لینک دانلود رایگان اپلکیشن http//i3l ir/getlenz
spam, کانال تلگرام «لنز» دسترسی آسان به جدیدترین فیلم ها و سریال ها http//t me/lenz_IPTV
spam, با کمک به ادامه تحصیل دانش آموزان نیازمند، دلی را شاد کنیم و حسرتی را کمرنگ  همراهی پرمهر شما در جشن عاطفه ها از طریق شماره گیری کد *8877*1# و یا مراجعه به سایت www emdad ir کمیته امداد امام خمینی(ره)
spam, حماسه ملت ایران در دفاع مقدس، نمایشگر ظرفیت های انسانی مردم این سرزمین خدایی است  مقام معظم رهبری
spam, بن تخفیف خرید اینترنتی کالا برای همه فقط با دانلود هر یک از آهنگ های پیشواز زیر با ارسال کد به 7575 فرزاد فرزین/عاشقانه/65 محمد علیزاده/ عشقم این روزا/71 علیرضا طلیسچی/نمیخوامت/88 قیمت 126تومان یک هفته
spam, بن تخفیف خرید اینترنتی کالا برای همه فقط با دانلود هر یک از آهنگ های پیشواز با ارسآل کد به 7575 بهترین های هوروش بند به کی پز می دی/ 34 به کی پز می دی2/ 35 یادتومی‌افتم/ 97 قیمت 126تومان یک هفته
