ham,خواهش می کنم
spam, بن تخفیف خرید اینترنتی کالا برای همه فقط با دانلود هر یک از آهنگ های پیشواز زیر با ارسال کد به 7575 فرزاد فرزین/عاشقانه/65 محمد علیزاده/ عشقم این روزا/71 علیرضا طلیسچی/نمیخوامت/88 قیمت 126تومان یک هفته
spam, جشنواره تابستانی سرویس آهنگ پیشواز ایرانسل سفر هفتگی به مالزی با دو همراه با ارسال کد به 7575 بهترین های ماکان بند این خیابونا/58 شیک/88 چشمای تو/28 قیمت 126تومان یک هفته
spam, جشنواره تابستانی سرویس آهنگ پیشواز ایرانسل سفر هفتگی به مالزی با دو همراه با ارسال کد به 7575 بهترین های بهنام بانی عاشقم کرده/77 عاشقم کرده قطعه دوم/78 همه دنیام/67 بسمه/68 قیمت 126تومان یک هفته
spam, مشترک شماره989367912866!دریافت قطعی شارژ1000تومنی بادعوت از2دوست در سرویس شیپور عضویت ارسال عدد1 100تومن
spam, مشترک عزیز، بسته  ماهانه«پیام پیشواز»شما تا24ساعت دیگرتمدید میشود درزمان تماس دوستانتان، باشکلک‌های دوست داشتنی D، ازآنهااستقبال کنید یاکسب وکارخودرامعرفی نمایید  به سادگی به روزرسانی پیامهادرشبکه های اجتماعی، میتوانیدپیامهای متنوعی رابه 8585بفرستیدتادرگوشی تماس گیرندگانتان نمایش داده شود  برای تغییر متن پیام پیشواز به اپلیکیشن ایرانسل من مراجعه کنید  http//i3l ir/myirnct هزینه تمدیدبسته450تومان لغوارسال0به8585
spam, یه شارژ هزاری مهمون ما! فقط امروز،بدون قرعه کشی برای همه،عدد 1 رو بفرست و شارژتو بگیر سرویس تخت گاز، قیمت روز خودرو عضویت روزی100تومن
spam, 1000تومان شارژ،بدون قرعه کشی هدیه به مشترک9367912866 دریافت باارسال1و دعوت از3نفر تخت گاز ترفندهای مراقبت ازخودرو عضویت درسرویس100تومان
spam, 1000تومن شارژبرای شماره9367912866 دریافت باارسال 1ودعوت از3نفر درتخت گاز از آخرین نوسانات بازارخودرومطلع شو عضویت در سرویس100تومان
spam, طرفدارای کدوم تیم بیشتره؟ استقلالیا4 پرسپولیسیا6 روارسال کنید وبا حمایت روزانه دویست تومنی و عضویت در قرعه کشی پورشه باکستر شرکت کنید
spam, پرشورهای آذری برای حمایت از تیممان همین حالا عدد3 رو ارسال کنیم و درقرعه کشی پورشه باکستر شرکت نماییم هواداری و عضویت روزی دویست تومن
spam, پرچممون بالاست! استقلالیا برای هواداری از تیممان 4روبه3090بفرستیدوباحمایت روزانه دویست تومنی وعضویت درقرعه کشی پورشه باکستر شرکت کنید
spam, هواداران به پا خیزید! استقلالیا 4 پرسپولیسیا 6 رو ارسال کنید و با حمایت روزانه دویست تومنی و عضویت در قرعه کشی پورشه باکستر شرکت کنید
spam, پورشه باکستر جایزه هواداری ازتیم محبوبتان برای عضویت و حمایت روزی 200تومنی پرسپولیسیا 6 استقلالیا 4 تراکتوریا 3 رو به3090ارسال کنید 
spam, هر دو هفته یک دستگاه IPHONE7 در مسابقه آنلاین کیو و شرکت در قرعه کشی جایزه بزرگ 3 میلیارد ریالی با ارسال عدد 1 به سرشماره 30706
spam, سرویس کارت ویزیت ایرانسل سفر7روزه مالزی ببر عضویت ارسال1به9595 600تومن
spam, مشترک گرامی بسته کارت ویزیت شما با موفقیت غیرفعال شد   اطلاع از متن کارت ویزیت فعال با ارسال CC به 9595  برای تغییر متن کارت ویزیت خود، پیام دلخواهتان را به 9595 ارسال نمایید 
spam, مشترک گرامی، بسته کارت ویزیت شما با موفقیت به روزرسانی شد  بسته فعلی پیام کارت ویزیت شما 11(شعر نو)  می باشد 
spam, مشترک گرامی عضویت شما  در سرویس کارت ویزیت ایرانسل با موفقیت تایید شد  شماره شما برای شرکت در قرعه کشی جشنواره تابستانی سفر 7 روزه به مالزی با دوهمراه ثبت شد  برای لغو عضویت 0 را به 9595 ارسال نمایید 
spam, نتیجه فال حافظ شما بزودی ارسال خواهدشد نیت کن عدد 1 رو به همین شماره بفرست با آرزوی بهترین ها عضویت درسرویس حافظ صدتومان
spam, تخفیف50% آموزش تصویری زبان انگلیسی نصرت ارزان،سریع ومثل آب خوردن انگلیسی صحبت کنید دانلود از لینک زیر http//charkhoneh com/s/2485
spam, شانس برنده شدن 4 دستگاه PS4 فقط با نصب رایگان مارکت چارخونه http//charkhoneh com/s/2698
spam, دریافت4000 تومن شارژ ایرانسل (با دعوت 4نفر) بدون قرعه کشی با نصب رایگان مارکت چارخونه http//charkhoneh com/s/2697
spam, تبریک! 1000 تومان شارژ هدیه برای شماره9367912866 دریافت با ارسال عدد1،فقط امروز سرویس جار، اخبار سیاسی روز عضویت روزی35تومان
spam, *تبریک* شما میتوانید برنده یکی از1000شارژ1000 تومنی رایگان باشید  شانستو امتحان کن روزی300تومن تاییددریافت وعضویت،ارسال 1نصب اپ فانوس
spam, مشترک گرامي، ضمن تشکر از پرداخت صورت حساب، شما مي توانيد با پرداخت غيرحضوري قبض خود تا پايان روز بيستم هر ماه  مشمول هديه يک روز مکالمه رايگان درون شبکه شويد 
spam, مشترک گرامي؛ جهت دريافت تنظيمات گوشي به آدرس mci ir www  مراجعه  و يا با 09990 تماس بگيريد 
spam, قبض شما با موفقيت پرداخت گرديد هر خريد از #1*   يک شانس شرکت در قرعه کشي ماهيانه پژو 206
spam, همراه اول – ستاره اول به #1* خوش آمديد از انتخاب شما جهت استفاده از اين سامانه سپاسگزاريم مرکز تماس (09129990 ) 9990 WWW MCI IR
spam, چطور به خواسته های نامعقول و غیرمنطقی دیگران نه بگوییم؟ ارسال عدد1 و عضویت در سرویس آموزش بهداشت روانشناسی پیامی100تومان
spam, ارسال شارژهدیه به دوستانتان با شمارگیری #1*142*
spam, مشترک989367912866 سلام رامبد جوان هستم حالتون چطوره؟ برای شما یک پیام صوتی ارسال کردم  شنیدن پیام وعضویت درسرویس هنر باارسال1 120 تومن
spam, *بانک تجارت  بانک فردا* تبریک صمیمانه مارا در سالروز تولدتان پذیرا باشید 
spam, خواندنی ترین مطالب جذاب در اپلیکیشن با خبر دانلود کن، سفر 7روزه به مالزی برنده شو لینک دانلود از بازار http//bit ly/Ba-Khabar
spam, با دانلود اپلیکیشن رایگان باخبر، برنده سفر7 روزه به مالزی باش  اخبارداغ روزانه و مقالات جذاب لینک دانلود http//bit ly/Bakhabar
spam, مشترک عزیز 09367912866 سرویس Business Card ، شما برنده بن تخفیف بامیلو به ارزش 15هزار تومان در ازای خرید 100 هزارتومان از جشنواره تابستانی ایرانسل شده اید  کد خرید bml7070_7b09138ffc تاریخ اعتبار 08 مهرماه 96 با مراجعه به http//bml re/mtn-r میتوانید از هدیه خود استقاده کنید 
spam, مشتري گرامي با آرزوي سعادت و سلامتي براي شما در سالروز تولدتان بانک ملت
spam, می خوای عمر ماشینت طولانی بشه؟ تخت گاز،ترفندهای مراقبت از خودرو 1000تومان شارژ برای همه باارسال1و دعوت از3نفر عضویت درسرویس100تومان
spam, همراه گرامی اگر تاکنون سیم کارت خود را با سیم کارت نسل 4 و 4 5 (یوسیم) تعویض نکرده اید، با ارسال کد پستی 10 رقمی خود به سرشماره 8962 و یا مراجعه به دفاتر خدمات مشتریان یا فروشگاه های همراه اول، علاوه بر دریافت رایگان یوسیم، از اینترنت هدیه 15 گیگابایت (مشترکین اعتباری) و 20 گیگابایت (مشترکین دایمی) بهره مند شوید  همراه اول
spam, کلاسهای تعاونی علمی آموزشی دانشگاه امیرکبیر ثبت نام+اطلاعاتWWW TAUTCO IR آخرین مهلت14مهرماه زبانتافل-آیلتس-مکالمه نرم افزارهای عمومی و تخصصی تلگرام https//goo gl/Fotkpe 02166496230 02166413523
spam, مدیریت هزینه با بسته های4G ایرانسل 4گیگ ماهانه 16500تومان *555*5*3*15#
spam, شاید تو برنده شده باشی! اسامی برندگان قرعه کشی ایرانسل را در  http//i3l ir/barandeha مشاهده کنید 
spam, تنظیمات اینترنت همراه گوشی شماارسال شد لطفا آنرا ذخیره نموده ودرصورت نیازبه رمز، 1234را وارد کنید  تبدیل سیمکارت به4Gبا کد #34*555*  Internet configurations for your phone were sent  Please save them & if a password was needed enter 1234  Dial*555*34# to swap your SIM to 4G 
spam, صعود غرور افرين تيم فوتبال پرسپوليس به مرحله نيمه نهايي جام باشگاههاي اسيا مبارك باد  ايرانسل حامي پرسپوليس در جام باشگاههاي اسيا
spam, همراه گرامي محسن رحمانيان مقدار 3 امتياز ويژه پرداخت قبض به حساب باشگاه فيروزه اي شما واريز شد  براي اطلاع از نحوه کسب امتيازات و مشاهده جوايز متنوع، به اپليکيشن يا پرتال همراه من به آدرس my mci ir بخش باشگاه فيروزه اي مراجعه نماييد  باشگاه فيروزه اي - باشگاه  مشتريان همراه اول
spam, مشترک9367912866 شمابرنده شارژ1000تومانی شدی 1 رو بفرست و۳تا ازدوستات رودعوت کن سرویس سینماتیکت،اخبارهنرمندان عضویت روزی120تومان
spam, مشترک9367912866 شماره شما به لیست قرعه کشی مرداد سرویس یادگیری اگلیسی اضافه شد برای تایید اشتراک1را به 737944بفرستید پیامی ۱۵۰تومان
spam, مالک خط9367912866 شما یک فایل تصویری دیده نشده دارید  دریافت باارسال1درغیراینصورت پیغام حذف می شه سرویس ایران دورت بگردم 150تومن
spam, بازی استراتژیک پسرخوانده همراه با 50 MBاینترنت رایگان دریافت هدیه تا فردا با نصب بازی پسرخوانده #با ارسال1 عضویت روزی سیصد تومن
spam, برگزاری دوره MBA  گرایشهای مدیریت اجرایی و بازاریابی، اعطای گواهینامه معتبر با تایید وزارت علوم، تحقیقات و فناوری سازمان مدیریت صنعتی ۳۲۲۸۵۰۴۵ داخلی ۱۱۴ و ۱۱۷
spam, آقا/خانم  محسن رحمانيان سلام، لطفا نسبت به تکمیل موجودی سپرده های پس انداز خود حداقل به میزان 20/000 تومان تا تاریخ 1396/06/23 جهت حضور در قرعه کشی اقدام فرمایید  بانک انصار، بانک تمام الکترونیک
spam, فاضل کلاس مکالمه زبان صددرصدتضمینی ترمیک2سال فشرده4یا9ماهه 07132338259
spam, تحویل فوری باتسهیلات قرض الحسنه در جشنواره تابستانه محصولات گروه سایپا
spam, فروشگاه بزرگ اكسير شروع حراج بزرگ تابستان مبلمان،تزئينات تهران 0218733
spam, * اپلیکیشن آوا یک قدم جلوتر از بقیه * جدیدترین آلبوم های موسیقی  با ارسال 1 موسیقی و فراتر ازآن * با قرعه کشی خودرو 206 *
spam, لذت محض یادگیری انگلیسی! توسط سرویس نبشت فقط با 10 دقیقه زمان در روز زبان انگلیسی خود را تقویت کنید و در قرعه کشی  جایزه 100000000 ریالی شرکت کنید  با ارسال 1 به 305058
spam, دوست عزیز برای عضویت در سرویس ویدئویی تاملی (ویدئو HD آشپزی) عدد 1 را به همین شماره ارسال کنید  در این اپلیکیشن روش پخت انواع غذاهای ایرانی و بین المللی بصورت ویدئو با کیفیت قرار داده شده است  ****از طرفی شما شانس برنده شدن ماهانه 10 شارژ 10000 ریالی به قید قرعه دارید ****  با ارسال 1 به همین شماره
spam, چهارمین ماراتون برنامه نویسی تلفن همراه کشور 23 الی 25 شهریور ماه دانشگاه صنعتی شریف جهت کسب اطلاع بیشتر http//mpm sharif ir/ https//telegram me/sharifIT
spam, مشترک گرامی با اپلیکیشن تخفیف اول از بیشترین تخفیف‌های کالا و خدمات فروشگاه‌های اینترنتی باخبر شوید  جهت عضویت عدد 111 را به همین شماره پیامک کنید 
spam, هایپراستار 8و5/9 پاکبان دوغ قوطی6ع40%ت فلاسک ست قاشق چنگال21ع 99000ت
spam, با خرید سیم کارت جدید یا استفاده مجدد از سیم کارتی که بیش از 3 ماه غیرفعال بوده است، در قرعه کشی 1000 گوشی هوشمند نسل 4 5 شرکت کنید 
spam, یه پیشنهاد به صرفه با شماره گیری *1000*1# از پیشنهاد بسته مکالمه خود مطلع شده و با مکالمه دقیقه ای 16 تومان، بیش از 70% تخفیف بگیرید 
spam, هر هفته یک موتور 1000 به ارزش 1000 میلیون ریال با استفاده از بسته های آلفا+ اینترنت همراه نوترینو خرید بسته با شماره گیری *100*2#
spam, سرویس کتاپ بدون قرعه کشی بن تخفیف بامیلو بگیرید ارسال1 به 2039  300ت
spam, تبريک! 20 امتياز ايرانسلي به دليل استفاده از اپليکشن ايرانسل من به شما تعلق گرفت  فقط تا پايان اين ماه فرصت داريد تا امتيازات خود را ازطريق کد #1*310* و يا از قسمت امتياز من در ايرانسل من به جايزه تبديل کنيد
spam, تبريک! شما 14گيگ اينترنت همراه 14 روزه به دليل تغييرسيمکارت خود به LTE دريافت کرديد  اطلاع از باقيمانده حساب  #33*141*
spam, تبريک! 20 امتياز ايرانسلي به دليل استفاده از اپليکشن ايرانسل من به شما تعلق گرفت  فقط تا پايان اين ماه فرصت داريد تا امتيازات خود را ازطريق کد #1*310* و يا از قسمت امتياز من در ايرانسل من به جايزه تبديل کنيد
spam, فاضل کلاس صددرصدتضمینی EPT MSRT چهارشنبه17الی21 آغاز4مرداد 07132338259
spam, فاضل گروه4آمادگی آزمون MSRT EPT پنج شبه 14تا18 آغاز12مرداد 07132338259
spam, تنظیمات اینترنت همراه گوشی شماارسال شد لطفا آنرا ذخیره نموده ودرصورت نیازبه رمز، 1234را وارد کنید  تبدیل سیمکارت به4Gبا کد #34*555*  Internet configurations for your phone were sent  Please save them & if a password was needed enter 1234  Dial*555*34# to swap your SIM to 4G 
spam, بسته ویژه 2گیگابایتی، 5000تومان خرید *5# مهلت استفاده تاپایان6مرداد
spam, مشترک گرامي،بسته يکماهه 3 گيگابايت  با هزينه 130000 ريال فعال شد  براي استفاده از بسته اينترنتي خود، اينترنت دستگاه خود را يکبار خاموش و مجددا روشن کنيد  اطلاع از حساب اينترنت همراه با شماره گيري کد زير و يا ازطريق برنامه کاربردي ايرانسل من دانلود از  http//irancell ir/myirancell *555*1*4*1#
spam, مشترک گرامي شارژ الکترونيکي انجام شد ريال  < مبلغ ريال 179 تا  1396/05/04حساب اصلي ريال 45872>اعتبار شما براي شارژ عادي عبارتست از  *7# خريدآسان شارژ با شماره گيري
spam, 10 برابر اعتبار مکالمه ایرانسلی با بسته های 1 روزه، 7 روزه و 30 روزه! همین حالا می توانید پیشنهاد خاص خودتان را از *4444*1#
spam, ایرانسلی عزیز شما می توانید با نصب رایگان برنامه ایرانسل من و دعوت از دوستانتان به این برنامه 1 روز اینترنت نامحدود هدیه بگیرید! دانلود رایگان ایرانسل من http//irancell ir/dlmyicl
spam, 6000 تومان اعتبارمکالمه 30روزه تنها باخریدبسته600تومانی *4444*1*4#
spam, 1گیگابایت اینترنت رایگان برای شماودوستانتان! شماره دوستان ایرانسلی خودرابه3116بفرستیدودعوت کنید سیمکارتشان را4Gکنند 
spam, 892810 کلمه عبور ورود به سیستم تنظیمات اینترنت همراه ایرانسل
spam, پیشنهاد های امروز ما برای آهنگ پیشوازی شما ارسال کد به 7575 فرزاد فرزین /عاشقانه/  68 فرزاد فرزین /عاشقانه 2/  69 فریدون آسرایی/ستگدل / 70 قیمت 300 تومان
spam, با ارسال کدهای زیر به 7575 پیشوازهای هفتگی داشته باشید (میلاد بیکدلو/ بـاران)24 (مرتضی پاشایـی/ قلبم رو تکراره) 26 (علیرضا طلیسچی/نمیخوامت)88 قیمت 126تومان یک هفته
spam, برای 9367912866فقط امروز 1000تومان شارژ رایگان  در پلان با ارسال 3 عضویت روزانه 300 تومان
spam, قبض964 آبونمان6300 مکالمه52998 پيام کوتاه3738 صندوق صوتي1245 صورتحساب64281 ماليات5785 بدهي76622 کسر هزار ريال688 قابل پرداخت146000 ريال ش ق7792464309054 ش پ14662400 دريافت جزئيات کارمزد خدمات با ارسال C و دريافت جزئيات خدمات مبتني بر محتوا و دولت الکترونيک با ارسال K
spam, با شماره گیری #۴۴۴۴*  طرحی خاص به شما پیشنهاد می کنیم که با استفاده از آن می توانید در هزینه های مکالمه و اینترنت خود صرفه جویی کنید 
spam, یک گیگ اینترنت یک روزه جایزه بگیر! کافیه به اپلیکیشن ایرانسل من بری و دوستتو به «لنز» دعوت کنی
spam, پیشنهادویژه 10برابراعتبارمکالمه#4444*1*
spam, مشترک گرامی،درخواست خرید بسته اینترنتی شما ثبت شد،و پس از فعال سازی از طریق پیامک به اطلاع شما خواهد رسید 
spam, بانک ملی ورود به سامانه بام 96/5/4 1031 خدمتی نو در سامانه بام، پرداخت اقساط تسهیلات ملی دیگران
spam, رمز یکبار مصرف شماره 989367912866 برای ورود 703671
spam, بانک قرض الحسنه مهر ايران حساب 4827-700-3759336-1 مبلغ2273000+ انتقال از اينترنت مانده2413000 تاريخ1396/5/4 ساعت1034
spam, بسته ویژه 2گیگابایتی، 5000تومان خرید *5# مهلت استفاده تاپایان18مرداد
spam, تبريک! 20 امتياز ايرانسلي به دليل استفاده از اپليکشن ايرانسل من به شما تعلق گرفت  فقط تا پايان اين ماه فرصت داريد تا امتيازات خود را ازطريق کد #1*310* و يا از قسمت امتياز من در ايرانسل من به جايزه تبديل کنيد
spam, تا 40 گیگا بایت اینترنت هدیه بگیرید!! خرید آنلاین محصولات دیجیتال از فروشگاه اینترنتی همراه اول https//shop mci ir
spam, لبیک اللهم لبیک پیشنهاد ویژه ایرانسل برای حجاج 10مگابایت اینترنت رایگان روزانه با شماره گیری *111*8# تعرفه ها (تومان) تماس ورودی و تماس با ایران هردقیقه 599 ارسال پیامک 299 اینترنت هرمگابایت 299
spam, سرویس کارت ویزیت ایرانسل بن تخفیف بامیلوبرای همه عضویت  ارسال1به9595
spam, بهترین های حامد همایون با ارسال کدهای زیر به 7575 پیشوازهای هفتگی داشته باشید شیدایی/41 چتر خیس/31 چنین کنم چنان کنم/81 قیمت 126تومان یک هفته
spam, با کافه سفر ،ایران رو بگرد ویلای دوبلکس برنده شو برای شرکت در قرعه کشی و تایید اشتراک روزانه سیصد تومنی عدد 1 را به 738985 ارسال کنید
spam, حالا دیگه وقتشه جَــــــــــــوونی کنی!!! 😊 با ارسال رایگان عدد 1 باعضویت در سرویس راز جوانی 120 تومان
spam, تبریک! شما واجد شرایط شرکت درقرعه کشی کارت هدیه یک میلیون ریالی هستید شرکت درقرعه کشی وتاییداشتراک سرویس صدتومنی سلام دکتر با ارسال 1
spam, رقابت وهیجان رادرنبض فوتبال دنبال کنید  عضویت دراین سرویس باارسال عدد1 قیمت99تومان
spam, جدید ترین قسمت  از سری فیلم های راکی را با اینترنت رایگان ایرانسل در لنز تماشا کنید لینک دانلود رایگان اپلیکیشن http//i3l ir/getlenz
spam, محمود به خانه ی «پیمان» میرود تا به خاطر فراری دادن  «هدیه» او را تنبیه کند قسمت چهاردهم عاشقانه هم اکنون با اینترنت رایگان ایرانسل در لنز لینک دانلود رایگان اپلیکیشن http//i3l ir/getlenz
spam, مشترک گرامی! همواره پیش از انجام تراکنش های اینترنتی از صحت آدرس وب سایت اعلام شده در پیامک ها و یا تبلیغات اینترنتی اطمینان حاصل نمایید، زیرا ممکن است این آدرس ها ظاهری موجه داشته باشند، ولی شما را به سایتی جعلی هدایت نمایند  معاونت پیشگیری از وقوع جرم قوه قضاییه 
spam, دبستان و پيش دبستاني بهاردانش باكادري مجرب عدالت جنوبي ك 52  38242758
spam, با او تمام غیر ممکن ها ممکن میشه!!! همین حا لا با ارسال عدد 1عضو سرویس هر روز با خدا شو 35تومان
spam, گرتومی خواهی مسلمان زیستن نیست ممکن جزبه قرآن زیستن عضویت درسرویس با خدا و دریافت آیه وحدیث ،روزخودراآسمانی کنید با ارسال 1 35 تومان
spam, به سرویس کارت ویزیت خوش آمدید  متن کارت ویزیت شما شب و روزتان  بخیر شماره شما برای شرکت در قرعه کشی امروز ماه مبارک رمضان ثبت شد   30 گوشی P10 30 میلیون کارت هدیه خرید و صدها هزار بن تخفیف خرید از بامیلو برای تغییر متن کارت ویزیت، متن دلخواه خود را به این شماره ارسال کنید  لغو با ارسال 0 به 9595
